{
 "_note": "Exported 2026-10-20 from a finished discourse-lens map (the app, not the skill). Metadata, topic labels, 2D placements and extracted claims only; no article text. Reference output for the skill prototype to reproduce or beat. Only articles placed on the map are included.",
 "topic": "jevons paradox and energy efficiency",
 "article_count": 52,
 "clusters": [
  {
   "cluster_id": 0,
   "label": "Jevons paradox explained",
   "description": "General explainers and policy-oriented analyses of how efficiency gains can raise total resource consumption, with historical context and implications for sustainability and economic growth.",
   "article_count": 19,
   "terms": [
    [
     "jevons",
     0.026721
    ],
    [
     "paradox",
     0.023089
    ],
    [
     "technological",
     0.008423
    ],
    [
     "policy",
     0.00673
    ],
    [
     "global",
     0.006279
    ],
    [
     "implications",
     0.005539
    ],
    [
     "analysis",
     0.004811
    ],
    [
     "resource consumption",
     0.004627
    ],
    [
     "scale",
     0.004582
    ],
    [
     "economic growth",
     0.004506
    ]
   ]
  },
  {
   "cluster_id": 1,
   "label": "Rebound effect economics",
   "description": "Articles defining direct and indirect rebound effects and weighing the evidence on how much efficiency savings are eroded by behavior and economic responses.",
   "article_count": 8,
   "terms": [
    [
     "policy",
     0.020102
    ],
    [
     "jevons",
     0.01417
    ],
    [
     "economic growth",
     0.01188
    ],
    [
     "paradox",
     0.01166
    ],
    [
     "direct",
     0.011203
    ],
    [
     "ecological",
     0.010082
    ],
    [
     "technological",
     0.009803
    ],
    [
     "energy economics",
     0.009491
    ],
    [
     "evidence",
     0.009472
    ],
    [
     "energy use",
     0.009159
    ]
   ]
  },
  {
   "cluster_id": 2,
   "label": "Efficiency as climate strategy",
   "description": "Institutional reports from agencies and think tanks arguing efficiency is the fastest, cheapest route to decarbonization, alongside renewables and electrification.",
   "article_count": 8,
   "terms": [
    [
     "global",
     0.016909
    ],
    [
     "measures",
     0.013467
    ],
    [
     "renewables",
     0.012177
    ],
    [
     "intensity",
     0.010575
    ],
    [
     "year",
     0.009971
    ],
    [
     "heat",
     0.009829
    ],
    [
     "electricity",
     0.009702
    ],
    [
     "electrification",
     0.009235
    ],
    [
     "climate",
     0.009036
    ],
    [
     "zero",
     0.00876
    ]
   ]
  },
  {
   "cluster_id": 3,
   "label": "Consumer efficiency basics",
   "description": "Introductory guides defining energy efficiency and offering practical advice, standards, and Energy Star-type tips for saving energy and money in homes and buildings.",
   "article_count": 6,
   "terms": [
    [
     "information",
     0.017699
    ],
    [
     "heat",
     0.014934
    ],
    [
     "electric",
     0.013716
    ],
    [
     "reducing",
     0.012799
    ],
    [
     "improving",
     0.011855
    ],
    [
     "energy star",
     0.011204
    ],
    [
     "water",
     0.010186
    ],
    [
     "energy use",
     0.010059
    ],
    [
     "standards",
     0.009571
    ],
    [
     "save",
     0.009507
    ]
   ]
  },
  {
   "cluster_id": 4,
   "label": "Jevons and AI economics",
   "description": "Pieces prompted by DeepSeek arguing cheaper computing and AI will increase demand, drawing on historical technology examples to explain why efficiency spurs usage.",
   "article_count": 4,
   "terms": [
    [
     "jevons",
     0.050166
    ],
    [
     "paradox",
     0.036998
    ],
    [
     "computing",
     0.028515
    ],
    [
     "occupations",
     0.017329
    ],
    [
     "applications",
     0.014354
    ],
    [
     "processing",
     0.013617
    ],
    [
     "brynjolfsson",
     0.011857
    ],
    [
     "food",
     0.011754
    ],
    [
     "technological",
     0.010625
    ],
    [
     "increased demand",
     0.010569
    ]
   ]
  },
  {
   "cluster_id": 5,
   "label": "AI's environmental footprint",
   "description": "Critical takes questioning whether Jevons paradox applies to AI, examining data centers, hardware, energy and water use, and the polarized environmental debate.",
   "article_count": 3,
   "terms": [
    [
     "hardware",
     0.008646
    ],
    [
     "direct",
     0.008619
    ],
    [
     "jevons",
     0.008537
    ],
    [
     "paradox",
     0.008043
    ],
    [
     "data centers",
     0.00782
    ],
    [
     "model",
     0.007271
    ],
    [
     "usage",
     0.00694
    ],
    [
     "environment",
     0.006918
    ],
    [
     "google",
     0.00647
    ],
    [
     "companies",
     0.006193
    ]
   ]
  }
 ],
 "articles": [
  {
   "id": "e535e0dd2e09ab1b",
   "url": "https://en.wikipedia.org/wiki/Jevons_paradox",
   "domain": "en.wikipedia.org",
   "title": "Jevons paradox - Wikipedia",
   "publish_date": "2004-09-15",
   "x": 0.2886904180049896,
   "y": -10.501059532165527,
   "cluster_id": 0
  },
  {
   "id": "198efba2d31ed4c9",
   "url": "https://news.northeastern.edu/2025/02/07/jevons-paradox-ai-future/",
   "domain": "news.northeastern.edu",
   "title": "What is Jevons Paradox? And why it may — or may not — predict AI’s future",
   "publish_date": "2025-02-07",
   "x": -3.1808125972747803,
   "y": -15.08942985534668,
   "cluster_id": 5
  },
  {
   "id": "27e43e9bae10a117",
   "url": "https://www.greenchoices.org/news/blog-posts/the-jevons-paradox-when-efficiency-leads-to-increased-consumption",
   "domain": "www.greenchoices.org",
   "title": "The Jevons Paradox: When Efficiency Leads to Increased Consumption – Green Choices",
   "publish_date": "2023-07-12",
   "x": -0.9533559083938599,
   "y": -11.985008239746094,
   "cluster_id": 0
  },
  {
   "id": "591278a2fa37869a",
   "url": "https://en.wikipedia.org/wiki/The_Coal_Question",
   "domain": "en.wikipedia.org",
   "title": "The Coal Question - Wikipedia",
   "publish_date": "2006-06-14",
   "x": 2.5199737548828125,
   "y": -12.497170448303223,
   "cluster_id": 0
  },
  {
   "id": "432077581f40f7cb",
   "url": "https://www.cio.com/article/247214/cloud-computing-has-its-jevons-moment.html",
   "domain": "www.cio.com",
   "title": "Cloud computing has its ‘Jevons Moment’",
   "publish_date": "2015-06-11",
   "x": -1.7847671508789062,
   "y": -14.006148338317871,
   "cluster_id": 4
  },
  {
   "id": "32ccdc382393a135",
   "url": "https://ohmyecon.org/journal/jevons-paradox-the-unintended-consequence-of-efficiency",
   "domain": "ohmyecon.org",
   "title": "Jevons Paradox: The Unintended Consequence of Efficiency — OhMyEcon",
   "publish_date": "2025-03-26",
   "x": -0.43354862928390503,
   "y": -13.429137229919434,
   "cluster_id": 0
  },
  {
   "id": "454fef2cc7c55716",
   "url": "https://en.wikipedia.org/wiki/William_Stanley_Jevons",
   "domain": "en.wikipedia.org",
   "title": "William Stanley Jevons - Wikipedia",
   "publish_date": "2003-04-07",
   "x": 1.128747820854187,
   "y": -12.310279846191406,
   "cluster_id": -1
  },
  {
   "id": "50bb5547d695eaf8",
   "url": "https://geoexpro.com/jevons-paradox/",
   "domain": "geoexpro.com",
   "title": "Jevons paradox - GeoExpro",
   "publish_date": "2024-11-27",
   "x": 4.1507568359375,
   "y": -11.434279441833496,
   "cluster_id": 0
  },
  {
   "id": "a5fd7c7199024da6",
   "url": "https://www.ricklindquist.com/blog/jevons-paradox",
   "domain": "www.ricklindquist.com",
   "title": "What is Jevons paradox? — Rick Lindquist",
   "publish_date": "2025-12-05",
   "x": -3.0377368927001953,
   "y": -13.872428894042969,
   "cluster_id": 4
  },
  {
   "id": "e26bbc229942e899",
   "url": "https://tinycomputers.io/posts/jevons-paradox.html",
   "domain": "tinycomputers.io",
   "title": "Jevons Paradox",
   "publish_date": "2025-04-15",
   "x": -1.3406394720077515,
   "y": -13.380971908569336,
   "cluster_id": 4
  },
  {
   "id": "4533db83111dad98",
   "url": "https://economicsfromthetopdown.com/2024/05/18/a-tour-of-the-jevons-paradox-how-energy-efficiency-backfires/",
   "domain": "economicsfromthetopdown.com",
   "title": "A Tour of the Jevons Paradox: How Energy Efficiency Backfires – Economics from the Top Down",
   "publish_date": "2024-05-18",
   "x": 1.8016111850738525,
   "y": -11.701616287231445,
   "cluster_id": 0
  },
  {
   "id": "9b5f58c6971ffd53",
   "url": "https://www.npr.org/sections/planet-money/2025/02/04/g-s1-46018/ai-deepseek-economics-jevons-paradox",
   "domain": "www.npr.org",
   "title": "Why the AI world is suddenly obsessed with a 160-year-old economics paradox",
   "publish_date": "2025-02-04",
   "x": -2.268458843231201,
   "y": -12.909899711608887,
   "cluster_id": 4
  },
  {
   "id": "85141bef8bb17318",
   "url": "https://en.wikipedia.org/wiki/Rebound_effect_(conservation)",
   "domain": "en.wikipedia.org",
   "title": "Rebound effect (conservation) - Wikipedia",
   "publish_date": "2007-03-31",
   "x": 2.1225407123565674,
   "y": -8.657750129699707,
   "cluster_id": 1
  },
  {
   "id": "901c3a5af8390dfb",
   "url": "https://ui.adsabs.harvard.edu/abs/2000EnPol..28..389A/abstract",
   "domain": "ui.adsabs.harvard.edu",
   "title": "Energy efficiency and consumption — the rebound effect — a survey",
   "publish_date": "2000-01-01",
   "x": 1.6154067516326904,
   "y": -7.946721076965332,
   "cluster_id": 1
  },
  {
   "id": "ae52c2880556e492",
   "url": "https://peri.umass.edu/publication/energy-efficiency-and-economy-wide-rebound-effects-a-review-of-the-evidence-and-its-implications/",
   "domain": "peri.umass.edu",
   "title": "Energy Efficiency and Economy-wide Rebound Effects: A Review of the Evidence and Its Implications",
   "publish_date": "2021-04-07",
   "x": 0.9692190289497375,
   "y": -8.247299194335938,
   "cluster_id": 1
  },
  {
   "id": "0f4a0e7aa31b7a6b",